gepris,title,subject_area,homepage,description,Applying institution,Co-applicant institution,Participating Institution,Spokesperson,Participating Persons,Co-Spokespersons,Cooperation partners
https://gepris.dfg.de/gepris/projekt/460129525,NFDI4Microbiota,Biology,,"Microbes – bacteria, archaea, unicellular eukaryotes, and viruses – play an important role in human and environmental health. Growing awareness of this fact has led to a huge increase in microbiological research and applications in a variety of fields. Driven by technological advances that allow high-throughput molecular characterization of microbial species and communities, microbiological research now offers unparalleled opportunities to address current and emerging needs. As well as helping to address global health threats such as antimicrobial resistance and viral pandemics, it also has a key role to play in areas such as agriculture, waste management, water treatment, ecosystems remediation, and the diagnosis, treatment and prevention of various diseases. Reflecting this broad potential, billions of euros have been invested in microbiota research programs worldwide. Though run independently, many of these projects are closely related. However, Germany currently has no infrastructure to connect such projects or even compare their results. Thus, the potential synergy of data and expertise is being squandered. The goal of the NFDI4Microbiota consortium is to serve and connect this broad and heterogeneous research community by elevating availability and quality of research results through dedicated training, and facilitating the generation, management, interpretation, sharing, and re-use of microbial data. By this we will also foster interdisciplinary interactions between researchers. NFDI4Microbiota will achieve this by creating a German microbial research network through training and community building activities, and by creating a cloud-based system that will make the storage, integration and analysis of microbial data, especially omics data, consistent, reproducible, and accessible across all areas of life sciences. In addition to increasing the quality of microbial research in Germany, its training program will support widespread and proper usage of these services. Through this dual emphasis on education and services, NFDI4Microbiota will ensure that microbial research in Germany is synergistic and efficient, and thus excellent.By creating a central resource for German microbial research, NDFDI4Microbiota will establish a connecting hub for all NFDI consortia that work with microbiological data, including GHGA, NFDI4Biodiversity, NFDI4Agri and several others. NFDI4Microbiota will provide non-“microbial”-specialists from these consortia with direct and easy access to the necessary expertise and infrastructure in microbial research in order to facilitate their daily work and enhance their research. The links forged through NFDI4Microbiota will not only increase the synergy between NFDI consortia, but also elevate the overall quality and relevance of microbial research in Germany.","[('Deutsche Zentralbibliothek für Medizin (ZB MED)Informationszentrum Lebenswissenschaften', 'https://gepris.dfg.de/gepris/institution/970784')]","[('European Molecular Biology Laboratory (EMBL)', 'https://gepris.dfg.de/gepris/institution/10100'), ('Friedrich-Schiller-Universität Jena', 'https://gepris.dfg.de/gepris/institution/10363'), ('Helmholtz-Zentrum für Infektionsforschung (HZI)', 'https://gepris.dfg.de/gepris/institution/10262'), ('Helmholtz-Zentrum für Umweltforschung (UFZ)', 'https://gepris.dfg.de/gepris/institution/10394'), ('Justus-Liebig-Universität Gießen', 'https://gepris.dfg.de/gepris/institution/10208'), ('Leibniz-Institut DSMZ-Deutsche Sammlung von Mikroorganismen und Zellkulturen GmbH', 'https://gepris.dfg.de/gepris/institution/10718'), ('Philipps-Universität Marburg', 'https://gepris.dfg.de/gepris/institution/10204'), ('Rheinisch-Westfälische Technische Hochschule Aachen', 'https://gepris.dfg.de/gepris/institution/10293'), ('Universität Bielefeld', 'https://gepris.dfg.de/gepris/institution/10280')]","[('Christian-Albrechts-Universität zu Kiel', 'https://gepris.dfg.de/gepris/institution/10337'), ('Deutsches Zentrum für Luft- und Raumfahrt e.V. (DLR)', 'https://gepris.dfg.de/gepris/institution/10317'), ('Forschungszentrum Jülich', 'https://gepris.dfg.de/gepris/institution/10319'), ('Fraunhofer-Gesellschaft zur Förderung der angewandten Forschung e.V.', 'https://gepris.dfg.de/gepris/institution/10147'), ('Fraunhofer-Institut für Molekularbiologie und Angewandte Oekologie', 'https://gepris.dfg.de/gepris/institution/30554'), ('Friedrich-Alexander-Universität Erlangen-Nürnberg', 'https://gepris.dfg.de/gepris/institution/10115'), ('GEOMAR Helmholtz-Zentrum für Ozeanforschung Kiel', 'https://gepris.dfg.de/gepris/institution/10339'), ('Georg-August-Universität Göttingen', 'https://gepris.dfg.de/gepris/institution/10236'), ('Goethe-Universität Frankfurt am Main', 'https://gepris.dfg.de/gepris/institution/10206'), ('Heinrich-Heine-Universität Düsseldorf', 'https://gepris.dfg.de/gepris/institution/10266'), ('Helmholtz Zentrum MünchenDeutsches Forschungszentrum für Gesundheit und Umwelt', 'https://gepris.dfg.de/gepris/institution/10150'), ('Helmholtz-Zentrum Potsdam - Deutsches GeoForschungsZentrum (GFZ)', 'https://gepris.dfg.de/gepris/institution/10376'), ('Julius-Maximilians-Universität Würzburg', 'https://gepris.dfg.de/gepris/institution/10121'), ('Karlsruher Institut für Technologie', 'https://gepris.dfg.de/gepris/institution/169579332'), ('Leibniz-Institut für Alternsforschung - Fritz-Lipmann-Institut e.V. (FLI)', 'https://gepris.dfg.de/gepris/institution/10416'), ('Leibniz-Institut für Gewässerökologie und Binnenfischerei (IGB)im Forschungsverbund Berlin e.V.', 'https://gepris.dfg.de/gepris/institution/10506'), ('Leibniz-Institut für Naturstoff-Forschung und Infektionsbiologie e. V.Hans-Knöll-Institut (HKI)', 'https://gepris.dfg.de/gepris/institution/10415'), ('Ludwig-Maximilians-Universität München', 'https://gepris.dfg.de/gepris/institution/10108'), ('Martin-Luther-Universität Halle-Wittenberg', 'https://gepris.dfg.de/gepris/institution/10357'), ('Max-Delbrück-Centrum für Molekulare Medizin (MDC)', 'https://gepris.dfg.de/gepris/institution/10420'), ('Max-Planck-Gesellschaft zur Förderung der Wissenschaften e.V. (MPG)', 'https://gepris.dfg.de/gepris/institution/12984'), ('Max-Planck-Institut für Biophysik', 'https://gepris.dfg.de/gepris/institution/10219'), ('Max-Planck-Institut für Dynamik komplexer technischer Systeme', 'https://gepris.dfg.de/gepris/institution/10727'), ('Max-Planck-Institut für Marine Mikrobiologie', 'https://gepris.dfg.de/gepris/institution/10558'), ('Max-Planck-Institut für Pflanzenzüchtungsforschung', 'https://gepris.dfg.de/gepris/institution/10313'), ('Otto-von-Guericke-Universität Magdeburg', 'https://gepris.dfg.de/gepris/institution/10359'), ('Rheinische Friedrich-Wilhelms-Universität Bonn', 'https://gepris.dfg.de/gepris/institution/10284'), ('Robert Koch-Institut (RKI)', 'https://gepris.dfg.de/gepris/institution/10179'), ('Ruhr-Universität Bochum', 'https://gepris.dfg.de/gepris/institution/10276'), ('Technische Hochschule Köln', 'https://gepris.dfg.de/gepris/institution/10309'), ('Technische Informationsbibliothek (TIB)', 'https://gepris.dfg.de/gepris/institution/13824'), ('Technische Universität Darmstadt', 'https://gepris.dfg.de/gepris/institution/10210'), ('Technische Universität München (TUM)', 'https://gepris.dfg.de/gepris/institution/10125'), ('Universität Duisburg-Essen', 'https://gepris.dfg.de/gepris/institution/972220'), ('Universität Greifswald', 'https://gepris.dfg.de/gepris/institution/10382'), ('Universität Hamburg', 'https://gepris.dfg.de/gepris/institution/10192'), ('Universität Ulm', 'https://gepris.dfg.de/gepris/institution/10057'), ('Universität zu Köln', 'https://gepris.dfg.de/gepris/institution/10282')]","[('Professor Dr. Konrad  Förstner', 'https://gepris.dfg.de/gepris/person/262159783')]",,"[('Professorin Dr. Anke  Becker', 'https://gepris.dfg.de/gepris/person/1592887'), ('Privatdozent Dr. Peer  Bork', 'https://gepris.dfg.de/gepris/person/1011382'), ('Professor Dr. Thomas  Clavel', 'https://gepris.dfg.de/gepris/person/184220620'), ('Professor Dr. Alexander  Goesmann', 'https://gepris.dfg.de/gepris/person/188428736'), ('Professorin Dr. Manuela  Marz', 'https://gepris.dfg.de/gepris/person/184034316'), ('Professorin Dr. Alice C.  McHardy', 'https://gepris.dfg.de/gepris/person/100717914'), ('Dr. Ulisses  Nunes da Rocha', 'https://gepris.dfg.de/gepris/person/433092727'), ('Professor Dr. Jörg  Overmann', 'https://gepris.dfg.de/gepris/person/1209510'), ('Professor Dr. Alexander  Sczyrba', 'https://gepris.dfg.de/gepris/person/221494134'), ('Professor Dr. Jens  Stoye', 'https://gepris.dfg.de/gepris/person/1688445')]",
https://gepris.dfg.de/gepris/projekt/460135501,MaRDI,Mathematics,,"Mathematical research data (MRD) has become vast, it is complex, multifaceted, and, by the interdisciplinary potential of mathematics with its power of abstraction, wide spread in the sciences. It emerges within mathematical sciences but also in other scientific areas, and ranges from highly complex data from scientific computing to information bases like the standard reference data for special functions, tables etc. of, e.g., the US National Institute for Standards and Technology. The data volume and its creation velocity increase dynamically with the rapid unfolding of mathematics in data science and the ever-increasing compute power. In various scientific fields (such as, e.g., physics, chemistry, engineering sciences, humanities and life sciences), this leads to increasingly complex mathematical and computational models, and extremely diverse MRD. We hence aim at developing a MRD infrastructure useful in mathematics and with significant impact in other fields.Motivated by demands of the mathematical community and other disciplines utilizing quantitative methods, MaRDI (Mathematical Research Data Initiative), the consortial initiative of mathematical sciences, aims to set standards for certified MRD, the design of confirmable workflows, and it provides community services. The designated goal is to realize the FAIR principles across all of mathematics and its applications, interoperability of data handling, and to propel new research.Targeting certified data, software developments, confirmable workflows, and the provision of services, the four research motivated pillars of MaRDI are computer algebra, scientific computing, statistics and machine learning, and interdisciplinary mathematical research. The latter leads to use cases and cooperations with the consortia NFDI4Ing, NFDI4Chem, NFDI4Culture, NFDI4Cat, and initiatives including PUNCH4NFDI, NFDI-MatWerk, NFDIxCS, NFDI-Neuro, BERD@NFDI, NFDI4DataScience, and NFDI4MobilTech.For MRD from the aforementioned fields standardized formats, data interoperability and application programming interfaces will be developed. Services on pilot level will be expanded into full services providing added value to current research.MaRDI will also significantly enhance information retrieval services, including mathematical models as research data, a cross-disciplinary mathematical digital semantic atlas, ontologies, and metadata such as, e.g., an algorithm metadata library.Moreover, MaRDI will develop a digital service portal as a one-stop unique contact point for the scientific community to retrieve and consult MaRDI services. This portal will be developed in an agile fashion and installed permanently.The sustainable realization of MaRDI findings requires a community adhering to a FAIR data culture and FAIR research workflows. MaRDI will thus build collaborative platforms which are pivotal for knowledge dissemination, the scientific discourse and quality control.","[('Weierstraß-Institut für Angewandte Analysis und Stochastik (WIAS)Leibniz-Institut im Forschungsverbund Berlin e. V.', 'https://gepris.dfg.de/gepris/institution/10505')]","[('Deutsche Mathematiker-Vereinigung e.V.c/o WIAS', 'https://gepris.dfg.de/gepris/institution/144774364'), ('FIZ KarlsruheLeibniz-Institut für Informationsinfrastruktur GmbH (FIZ KA)', 'https://gepris.dfg.de/gepris/institution/12898'), ('Fraunhofer-Gesellschaft zur Förderung der angewandten Forschung e.V.', 'https://gepris.dfg.de/gepris/institution/10147'), ('Fraunhofer-Institut für Techno- und Wirtschaftsmathematik (ITWM)', 'https://gepris.dfg.de/gepris/institution/10825'), ('Konrad-Zuse-Zentrum für Informationstechnik Berlin (ZIB)', 'https://gepris.dfg.de/gepris/institution/10524'), ('Ludwig-Maximilians-Universität München', 'https://gepris.dfg.de/gepris/institution/10108'), ('Mathematisches Forschungsinstitut Oberwolfach gGmbH', 'https://gepris.dfg.de/gepris/institution/12909'), ('Max-Planck-Gesellschaft zur Förderung der Wissenschaften e.V. (MPG)', 'https://gepris.dfg.de/gepris/institution/12984'), ('Max-Planck-Institut für Dynamik komplexer technischer Systeme', 'https://gepris.dfg.de/gepris/institution/10727'), ('Max-Planck-Institut für Mathematik in den Naturwissenschaften (MIS)', 'https://gepris.dfg.de/gepris/institution/10696'), ('Technische Universität Berlin', 'https://gepris.dfg.de/gepris/institution/10167'), ('Technische Universität Kaiserslautern', 'https://gepris.dfg.de/gepris/institution/10325'), ('Technische Universität München (TUM)', 'https://gepris.dfg.de/gepris/institution/10125'), ('Universität Leipzig', 'https://gepris.dfg.de/gepris/institution/10351'), ('Universität Stuttgart', 'https://gepris.dfg.de/gepris/institution/10059'), ('Westfälische Wilhelms-Universität Münster', 'https://gepris.dfg.de/gepris/institution/10272')]","[('European Mathematical Society', 'https://gepris.dfg.de/gepris/institution/442134826'), ('Gesellschaft für Angewandte Mathematik und Mechanik e.V. (GAMM)', 'https://gepris.dfg.de/gepris/institution/133467838'), ('Gesellschaft für Operations Research (GOR) e.V.', 'https://gepris.dfg.de/gepris/institution/460195390'), ('IMAGINARY gGmbH', 'https://gepris.dfg.de/gepris/institution/442145516')]","[('Professor Dr. Michael  Hintermüller', 'https://gepris.dfg.de/gepris/person/120380823')]","[('Professor Dr. Peter  Bastian', 'https://gepris.dfg.de/gepris/person/1377809'), ('Professorin Dr. Bettina  Eick', 'https://gepris.dfg.de/gepris/person/374800'), ('Professor Dr. Thomas  Ertl', 'https://gepris.dfg.de/gepris/person/1554846'), ('Professor Dr.-Ing. Dieter W.  Fellner', 'https://gepris.dfg.de/gepris/person/1407789'), ('Professor Dr. Michael  Kohlhase', 'https://gepris.dfg.de/gepris/person/259075'), ('Professor Dr. Martin  Skutella', 'https://gepris.dfg.de/gepris/person/1634094')]","[('Professorin Dr. Ilka  Agricola', 'https://gepris.dfg.de/gepris/person/1829568'), ('Professor Dr. Peter  Benner', 'https://gepris.dfg.de/gepris/person/1613079'), ('Professor Dr. Bernd  Bischl', 'https://gepris.dfg.de/gepris/person/289708818'), ('Professor Dr. Wolfram  Decker', 'https://gepris.dfg.de/gepris/person/1030695'), ('Professor Dr. Mathias  Drton, Ph.D.', 'https://gepris.dfg.de/gepris/person/459300836'), ('Professor Dr. Claus  Fieker', 'https://gepris.dfg.de/gepris/person/239413228'), ('Professor Dr. Dominik  Göddeke', 'https://gepris.dfg.de/gepris/person/48820728'), ('Professor Dr. Michael  Joswig', 'https://gepris.dfg.de/gepris/person/1695940'), ('Professor Dr. Stephan  Klaus', 'https://gepris.dfg.de/gepris/person/277129589'), ('Professor Dr. Mario  Ohlberger', 'https://gepris.dfg.de/gepris/person/1801137'), ('Professor Dr. Harald  Sack', 'https://gepris.dfg.de/gepris/person/252852060'), ('Professorin Dr. Anita  Schöbel', 'https://gepris.dfg.de/gepris/person/2049167'), ('Professor Dr. Christof  Schütte', 'https://gepris.dfg.de/gepris/person/1665945'), ('Professor Dr. Rainer  Sinn', 'https://gepris.dfg.de/gepris/person/425853170'), ('Professor Dr. Bernd  Sturmfels, Ph.D.', 'https://gepris.dfg.de/gepris/person/1908530')]",
https://gepris.dfg.de/gepris/projekt/460197019,FAIRmat,Physics,,"Scientific data are a significant raw material of the 21st century. To exploit their value, a FAIR – Findable, Accessible, Interoperable, and Re-purposable – data infrastructure (DI) is a must. Making data Findable and AI Ready (an alternative interpretation of the acronym) will change the way how science is done today. For the wider field of condensed-matter physics and the chemical physics of solids, FAIRmat sets out to make this happen. Integrating synthesis, experiment, theory, computations, and applications, it will substantially further the basic physical sciences, reaching out to chemistry, engineering, industry, and society.Why are FAIRmat’s research data so important? Simply speaking, the prosperity and lifestyle of our society are very much governed by achievements of this field as new products from the energy, environment, health, mobility, IT sectors, etc. very much rely on improved or even novel materials. Examples are solid-state lighting, touch screens, batteries, implants, and many more. Boosted by the US Materials Genome Initiative (MGI), an enormous amount of data on materials (basic and applied science and engineering) has been produced in recent years. These data are largely kept on local servers, but their characterization is typically incomplete. Without an efficient DI, the data are neither easily accessible nor re-usable. In this NFDI project, FAIRmat will •	Create a federated FAIR DI for materials data with a central hub, the FAIRmat Portal;•	Advance and develop metadata schemas and ontologies;•	Enable efficient exchange of the FAIR research data, ensuring that the FAIRmat DI will advance basic science of condensed-matter and materials physics with very little burden for active researchers and also be of great value for engineering; •	Convince scientists to also share data they consider useless for their present purpose-oriented research;•	Reach out within and beyond its community providing advice, training, and user support.FAIRmat represents a broad community of numerous researchers from universities and leading institutions in Germany. It builds on extensive experience with the worldwide biggest data infra-structure in computational materials science, the Novel Materials Discovery (NOMAD) Laboratory and the association FAIR-DI e.V. FAIRmat aims at covering the full breadth of the Condensed Matter Section of the German Physical Society (DPG) with its 12 divisions, and is further supported by the Chemistry, Physics, and Technology Section of the Max Planck Society, the Bun-sen Society for Physical Chemistry, and more. It is fully embedded internationally, e.g., in the Research Data Alliance, the European Open Science Cloud, GO FAIR, etc. and has signed Memoranda of Understanding with leading institutions worldwide, for example NIST (USA), Shanghai University (China), and CSC (Finland). FAIRmat will continue to raise awareness and acceptance of a FAIR research-data infrastructure in Germany, Europe, and beyond.","[('Humboldt-Universität zu Berlin', 'https://gepris.dfg.de/gepris/institution/10365')]","[('FAIR-DI e.V.Humboldt-Universität zu Berlin', 'https://gepris.dfg.de/gepris/institution/459711442'), ('Fritz-Haber-Institut der Max-Planck-Gesellschaft (FHI)', 'https://gepris.dfg.de/gepris/institution/10172'), ('Karlsruher Institut für Technologie', 'https://gepris.dfg.de/gepris/institution/169579332'), ('Leibniz-Institut für Kristallzüchtung (IKZ)im Forschungsverbund Berlin e.V.', 'https://gepris.dfg.de/gepris/institution/10510'), ('Max-Planck-Gesellschaft zur Förderung der Wissenschaften e.V. (MPG)', 'https://gepris.dfg.de/gepris/institution/12984'), ('Max-Planck-Institut für Chemische Energiekonversion (CEC)', 'https://gepris.dfg.de/gepris/institution/10315'), ('Technische Universität München (TUM)', 'https://gepris.dfg.de/gepris/institution/10125')]","[('Deutsche Physikalische Gesellschaft e. V.', 'https://gepris.dfg.de/gepris/institution/20777556'), ('Technische Informationsbibliothek (TIB)', 'https://gepris.dfg.de/gepris/institution/13824')]","[('Professorin Dr. Claudia  Draxl', 'https://gepris.dfg.de/gepris/person/1981459')]","[('Professor Dr. Martin  Aeschlimann', 'https://gepris.dfg.de/gepris/person/1600019'), ('Professor Dr. Sören  Auer', 'https://gepris.dfg.de/gepris/person/54678503'), ('Privatdozent Dr. Carsten  Baldauf', 'https://gepris.dfg.de/gepris/person/123741414'), ('Dr. Tristan  Bereau', 'https://gepris.dfg.de/gepris/person/270624820'), ('Professor Dr. Stefan  Blügel', 'https://gepris.dfg.de/gepris/person/1457346'), ('Professorin Dr. Silvana  Botti', 'https://gepris.dfg.de/gepris/person/252354936'), ('Professor Dr. Christoph J.  Brabec', 'https://gepris.dfg.de/gepris/person/164129600'), ('Malte  Dreyer', 'https://gepris.dfg.de/gepris/person/72967371'), ('Dr. Natascha  Dropka', 'https://gepris.dfg.de/gepris/person/429000174'), ('Professor Dr. Ralph  Ernstorfer', 'https://gepris.dfg.de/gepris/person/224474795'), ('Professor Dr. Norbert  Esser', 'https://gepris.dfg.de/gepris/person/1422896'), ('Professorin Dr. Claudia  Felser', 'https://gepris.dfg.de/gepris/person/1826843'), ('Dr. Luca  Ghiringhelli', 'https://gepris.dfg.de/gepris/person/243426491'), ('Professor Dr. Roger  Gläser', 'https://gepris.dfg.de/gepris/person/1606443'), ('Professor Dr. Axel  Groß', 'https://gepris.dfg.de/gepris/person/1488882'), ('Professor Dr. Marius  Grundmann', 'https://gepris.dfg.de/gepris/person/1078414'), ('Professor Dr. Aleksander  Gurlo', 'https://gepris.dfg.de/gepris/person/26928434'), ('Dr. Thomas  Hammerschmidt', 'https://gepris.dfg.de/gepris/person/167715286'), ('Privatdozent Dr. Tamás  Haraszti', 'https://gepris.dfg.de/gepris/person/24123225'), ('Professor Dr. Stefan  Hecht', 'https://gepris.dfg.de/gepris/person/1821462'), ('Professor Dr. Thomas  Heine', 'https://gepris.dfg.de/gepris/person/1777720'), ('Kerstin  Helbig', 'https://gepris.dfg.de/gepris/person/398768479'), ('Professor Dr. Jürgen  Janek', 'https://gepris.dfg.de/gepris/person/1119776'), ('Heinz  Junkes', 'https://gepris.dfg.de/gepris/person/442558798'), ('Professor Dr. Christoph Tobias  Koch, Ph.D.', 'https://gepris.dfg.de/gepris/person/1848965'), ('Professor Dr. Kurt  Kremer', 'https://gepris.dfg.de/gepris/person/1425776'), ('Dr. Michael  Krieger', 'https://gepris.dfg.de/gepris/person/238801098'), ('Professor Dr. Josef Alfons  Käs', 'https://gepris.dfg.de/gepris/person/1349537'), ('Professorin Dr. Sarah Friederike  Köster', 'https://gepris.dfg.de/gepris/person/34262755'), ('Markus Tobias  Kühbach', 'https://gepris.dfg.de/gepris/person/390780324'), ('Dr. Hermann  Lederer', 'https://gepris.dfg.de/gepris/person/442559615'), ('Professorin Dr. Ingrid  Mertig', 'https://gepris.dfg.de/gepris/person/1186122'), ('Professor Dr. Wolfgang E.  Nagel', 'https://gepris.dfg.de/gepris/person/9608598'), ('Professorin Dr. Rossitza  Pentcheva', 'https://gepris.dfg.de/gepris/person/1773066'), ('Professor Dr.-Ing. Dierk  Raabe', 'https://gepris.dfg.de/gepris/person/1347629'), ('Professor Dr. Alexander  Reinefeld', 'https://gepris.dfg.de/gepris/person/1597692'), ('Professor Dr. Karsten  Reuter', 'https://gepris.dfg.de/gepris/person/1684947'), ('Dr. Raphael  Ritz', 'https://gepris.dfg.de/gepris/person/1396653'), ('Dr. Cesar  Rodriguez-Emmenegger, Ph.D.', 'https://gepris.dfg.de/gepris/person/340976942'), ('Professor Dr. Erich  Runge', 'https://gepris.dfg.de/gepris/person/12876882'), ('Dr. Markus  Scheidgen', 'https://gepris.dfg.de/gepris/person/237497325'), ('Professor Dr. Robert  Schlögl', 'https://gepris.dfg.de/gepris/person/1254982'), ('Professor Dr. Thomas  Schröder', 'https://gepris.dfg.de/gepris/person/14905879'), ('Professor Dr. Godehard  Sutmann', 'https://gepris.dfg.de/gepris/person/227917990'), ('Dr. Annette  Trunschke', 'https://gepris.dfg.de/gepris/person/1731117'), ('Dr. Thomas  Unold', 'https://gepris.dfg.de/gepris/person/1564363'), ('Professorin Dr. Maria Roser  Valenti', 'https://gepris.dfg.de/gepris/person/1454788'), ('Professor Dr. Heiko B.  Weber', 'https://gepris.dfg.de/gepris/person/1831359'), ('Dr. Dieter  Weber', 'https://gepris.dfg.de/gepris/person/442566907'), ('Dr. Holger von Wenckstern', 'https://gepris.dfg.de/gepris/person/118865223'), ('Professor Dr.-Ing. Stefan  Wesner', 'https://gepris.dfg.de/gepris/person/188702012'), ('Professor Dr. Joachim  Wosnitza', 'https://gepris.dfg.de/gepris/person/1334386')]","[('Dr. Martin  Albrecht', 'https://gepris.dfg.de/gepris/person/1465230'), ('Professor Dr. Hans-Joachim  Bungartz', 'https://gepris.dfg.de/gepris/person/1474445'), ('Dr. Mark  Greiner', 'https://gepris.dfg.de/gepris/person/442566639'), ('Professor Dr. Matthias  Scheffler', 'https://gepris.dfg.de/gepris/person/1250089'), ('Professor Dr. Christof  Wöll', 'https://gepris.dfg.de/gepris/person/1334453')]",
